slug,title
how-to-use-a-bidet,How to Use a Bidet
how-to-install-a-mini-split,How to Install a Mini Split
how-to-remove-stains-from-walls-and-ceilings,How to Remove Stains from Walls and Ceilings
tips-and-ideas-to-edge-your-lawn,Tips and Ideas to Edge Your Lawn
how-to-paint-trim,How to Paint Trim
how-to-measure-a-range-for-your-kitchen,How to Measure a Range for Your Kitchen
how-to-tie-dye,How to Tie-Dye 
how-to-make-a-terra-cotta-pot-fountain,How to Make a Terra Cotta Pot Fountain
light-the-way-diy-lamp-post-re-do,Light the Way: DIY Lamp Post Re-Do
how-to-clean-headlights,How to Clean Headlights
how-to-make-a-mosquito-repellent-station,How to Make a Mosquito Repellent Station
home-inspections-checklist,Home Inspections Checklist
how-to-make-a-tile-planter,How to Make a Tile Planter
how-to-make-a-terrarium,How to Make a Terrarium
how-to-decorate-a-pumpkin,How to Decorate a Pumpkin
how-to-change-a-shower-head,How to Change a Shower Head
how-to-clean-laminate-floors,How to Clean Laminate Floors
how-to-build-a-post-and-rail-fence,How to Build a Post-and-Rail Fence
how-to-hang-a-pegboard,How to Hang a Pegboard
how-to-get-instant-spring-color-in-containers,How to Get Instant Spring Color in Containers
how-to-get-rid-of-poison-ivy-plants,How to Get Rid of Poison Ivy Plants
how-to-build-fence-sections,How to Build Fence Sections
how-to-turn-a-shoebox-into-a-storage-container,How to Turn a Shoebox into a Storage Container 
dividing-perennials,Dividing Perennials
how-to-install-vinyl-flooring,How to Install Vinyl Flooring
how-to-refinish-a-deck,How to Refinish a Deck
how-to-tarp-a-roof,How to Tarp a Roof
make-dried-flower-christmas-ornaments,Make Dried Flower Christmas Ornaments
how-to-measure-for-vertical-blinds,How to Measure for Vertical Blinds
how-to-create-a-restroom-cleaning-log,How to Create a Restroom Cleaning Log
how-to-create-a-three-season-garden-bed,How to Create a Three-Season Garden Bed
diy-underground-wiring,DIY Underground Wiring
how-to-remove-popcorn-ceilings,How to Remove Popcorn Ceilings
how-to-measure-a-dishwasher,How to Measure a Dishwasher
how-to-change-smoke-alarm-batteries,How to Change Smoke Alarm Batteries
how-to-get-rid-of-algae-in-a-pool,How to Get Rid of Algae in a Pool
how-to-build-a-ramp,How to Build a Ramp
how-to-get-rid-of-snakes,How to Get Rid of Snakes
how-to-checking-transmission-fluid,How To Check Transmission Fluid
how-to-install-a-carbon-monoxide-detector,How To Install a Carbon Monoxide Detector
diy-raised-garden-bed,DIY Raised Garden Bed
how-to-build-a-gazebo,How to Build a Gazebo
how-to-use-a-string-trimmer,How to Use a String Trimmer 
trellising-tomatoes,Trellising Tomatoes
pruning-rose-care-project-guide,How to Prune Roses
how-to-weld,How to Weld
how-to-make-homemade-hand-cream-for-your-favorite-gardener,How to Make Homemade Hand Cream for Your Favorite Gardener
how-to-install-a-bathroom-mirror,How to Install a Bathroom Mirror
diy-plant-markers,DIY Plant Markers
how-to-clean-baseboards,How to Clean Baseboards
how-to-trim-hedges,How to Trim Hedges
how-to-use-a-hand-saw,How to Use a Hand Saw
how-to-use-a-jigsaw,How to Use a Jigsaw
how-to-fix-a-doorbell,How to Fix a Doorbell
how-to-use-a-ratchet-strap,How to Use a Ratchet Strap
ceiling-fan-direction-in-summer-and-winter,Ceiling Fan Direction in Summer and Winter
how-to-mortise-a-door-latch,How to Mortise a Door Latch
how-to-find-and-test-a-doorbell-transformer,How to Find and Test a Doorbell Transformer
how-to-plant-a-wildflower-garden-with-seeds,How to Plant a Wildflower Garden With Seeds
how-to-trellis-cucumbers,How to Trellis Cucumbers
evaporative-cooler-installation,Evaporative Cooler Installation
make-a-botanical-table-runner-for-your-holiday-table,Make a Botanical Table Runner for Your Holiday Table
how-to-install-a-fire-escape-ladder,How to Install a Fire Escape Ladder
how-to-clean-a-range-hood,How to Clean a Range Hood
how-to-measure-for-cellular-pleated-roman-shades,How to Measure for Cellular Pleated Roman Shades
how-to-dry-herbs,How to Dry Herbs
how-to-grow-rhubarb,How to Grow Rhubarb
hot-tub-prep-and-installation,Hot Tub Prep and Installation 
how-to-install-a-window-air-conditioner,How To Install A Window Air Conditioner
how-to-clean-an-iron,How To Clean An Iron 
how-to-make-a-hanging-basket-planter,How to Make a Hanging Basket Planter
how-to-install-a-hanging-light-fixture,How to Install a Hanging Light Fixture
how-to-change-a-home-air-filter,How to Change a Home Air Filter
how-to-make-rosemary-honey,How to Make Rosemary Honey
low-maintenance-landscaping,Low Maintenance Landscaping
how-to-make-a-butterfly-island-bed,How to Make a Butterfly Island Bed
how-to-plan-a-backyard-camping-adventure,How to Plan a Backyard Camping Adventure
how-to-clean-glass-shower-doors,How to Clean Glass Shower Doors
how-to-cut-plexiglass,How to Cut Plexiglass
how-to-heat-a-swimming-pool-with-an-air-conditioner,How to Heat a Swimming Pool with an Air Conditioner
summer-projects-for-kids,Summer Projects for Kids
how-to-clean-your-bathtub,How to Clean Your Bathtub
how-to-use-an-impact-driver,How to Use an Impact Driver
how-to-make-a-stylish-christmas-tree-dress-centerpiece,How to Make a Stylish Christmas Tree Dress Centerpiece
how-to-clean-a-bird-feeder,How to Clean a Bird Feeder
how-to-get-paint-out-of-clothes,How to Get Paint Out of Clothes
how-to-load-a-dishwasher,How to Load a Dishwasher
how-to-make-a-stacked-flowerpot-centerpiece,How to Make a Stacked Flowerpot Centerpiece
how-to-install-drip-irrigation,How to Install Drip Irrigation
how-to-install-cabinet-handles,How to Install Cabinet Handles
how-to-repair-laminate-flooring,How to Repair Laminate Flooring
how-to-use-a-fire-extinguisher,How to Use a Fire Extinguisher
how-to-install-a-pool-pump,How to Install a Pool Pump
how-to-make-a-christmas-advent-calendar,How to Make a Christmas Advent Calendar
how-to-clean-brass,How to Clean Brass
how-to-fix-cracked-tile,How to Fix Cracked Tile
how-to-clean-stainless-steel,How to Clean Stainless Steel
how-to-measure-for-plantation-shutters,How to Measure for Plantation Shutters
diy-terra-cotta-storage-containers,DIY Terra Cotta Storage Containers
easy-DIY-methods-for-cleaning-any-coffee-maker,Easy DIY Methods for Cleaning Any Type of Coffee Maker
how-to-use-a-scroll-saw,How to Use a Scroll Saw
how-to-measure-distance-with-a-laser,How to Measure Distance With a Laser
how-to-replace-a-circuit-breaker,How to Replace a Circuit Breaker
how-to-measure-for-blinds-and-shades,How To Measure for Blinds and Shades
how-to-start-seeds-at-home-with-a-gardening-starter-kit,How to Start Seeds at Home with a Gardening Starter Kit
how-to-install-a-tankless-water-heater,How to Install a Tankless Water Heater
how-to-grow-sunflowers,How to Grow Sunflowers
how-to-wash-pillows,How to Wash Pillows
how-to-patch-a-lawn-with-seed,How to Patch a Lawn 
make-a-wood-christmas-tree-collar,Make a Wood Christmas Tree Collar
how-to-clean-an-awning,How to Clean An Awning
how-to-adjust-motion-light-sensor-settings,How to Adjust Motion Light Sensor Settings
how-to-install-a-tub-spout,How to Install a Tub Spout
how-to-measure-a-kitchen-sink,How To Measure A Kitchen Sink 
how-to-install-runoff-trenches-around-your-driveway,How to Install Runoff Trenches Around Your Driveway
how-to-calculate-square-footage,How to Calculate Square Footage
how-to-use-a-lock-washer,How to Use a Lock Washer
how-to-plant-hurricane-resistant-trees,How to Plant Hurricane-Resistant Trees
how-to-make-a-diy-arts-and-crafts-caddy,How to Make a DIY Arts and Crafts Caddy
how-to-shovel-snow,How to Shovel Snow
how-to-maintain-garage-door-openers,How to Maintain Garage Door Openers
how-to-iron,How to Iron 
how-to-clean-wallpaper,How to Clean Wallpaper
when-to-plant-tomatoes,When to Plant Tomatoes
how-to-hang-a-picture,How to Hang a Picture
how-to-harvest-lettuce,How to Harvest Lettuce
how-to-calculate-deck-materials,How to Calculate Deck Materials
how-to-install-a-dimmer-switch,How to Install a Dimmer Switch
how-to-stake-a-tree,How to Stake a Tree
how-to-plant-a-bare-root-rose,How To Plant a Bare-Root Rose
how-to-build-a-garden-arbor,How to Build a Garden Arbor
how-to-change-a-refrigerator-water-filter,How to Change a Refrigerator Water Filter
how-to-clean-hardwood-floors,How to Clean Hardwood Floors
how-to-get-rid-of-carpet-beetles,How to Get Rid of Carpet Beetles
how-to-program-a-thermostat,How to Program a Thermostat
recessed-lighting-for-drop-ceiling,How to Install Recessed Lights in a Drop Ceiling
winter-fire-prevention-&-safety-tips-for-apartments,Winter Fire Prevention & Safety Tips for Apartments
how-to-cut-crown-moulding,How to Cut Crown Moulding
how-to-install-a-door-lock,How to Install a Door Lock
how-to-cut-down-a-tree,How to Cut Down a Tree
how-to-make-a-christmas-centerpiece,How to Make a Christmas Centerpiece
how-to-prep-a-house-for-painting,How to Prep a House for Painting
how-to-make-a-paver-planter,How to Make a Paver Planter
how-to-build-a-root-cellar,How to Build a Root Cellar
how-to-install-spit-rail-fence,How to Install Split Rail Fence
how-to-hang-a-tapestry,How to Hang a Tapestry
how-to-paint-a-bathroom-vanity,How to Paint a Bathroom Vanity
how-to-make-slime,How to Make Slime
how-to-clean-paint-brushes,How to Clean Paint Brushes
how-to-grow-and-care-for-a-snake-plant,How to Grow and Care for a Snake Plant
how-to-light-a-gas-fireplace,How to Light a Gas Fireplace
how-to-hang-outdoor-string-lights,How to Hang Outdoor String Lights
how-to-use-a-miter-saw,How to Use a Miter Saw
how-to-install-flush-and-semi-flush-mount-lighting,How to Install Flush and Semi-Flush Mount Lighting
how-to-crosscut-and-rip-with-a-circular-saw,How to Crosscut and Rip with a Circular Saw
diy-pumpkin-flower-pot,DIY Pumpkin Flower Pot
how-to-make-a-witch-hat-door-hanger,How to Make a Witch Hat Door Hanger
how-to-change-a-table-saw-blade,How to Change a Table Saw Blade
how-to-start-a-fireplace-fire,How to Start a Fireplace Fire
how-to-drill-a-hole-in-glass,How to Drill a Hole in Glass
how-to-measure-windows,How to Measure Windows
how-to-move-heavy-furniture,How to Move Heavy Furniture 
how-to-make-a-christmas-wreath,How to Make a Christmas Wreath
how-to-install-an-undermount-sink-,How to Install an Undermount Sink 
how-to-install-a-dryer-vent,How to Install a Dryer Vent
how-to-install-a-toilet-paper-holder,How to Install a Toilet Paper Holder
how-to-pressure-wash-a-house,How to Pressure Wash a House 
build-a-chicken-coop,How to Build a Chicken Coop
how-to-clean-a-grill,How to Clean a Grill
how-to-install-exterior-shutters,How to Install Exterior Shutters
diy-holiday-wood-trees,DIY Holiday Wood Trees
how-to-get-paint-out-of-carpet,How to Get Paint Out of Carpet
how-to-clean-a-lampshade,How to Clean a Lamp Shade
how-to-steep-tea,How to Steep Tea
how-to-finish-inside-drywall-corners,How to Finish Inside Drywall Corners
how-to-clean-an-air-conditioner-filter,How to Clean an Air Conditioner Filter
how-to-weatherproof-windows,How to Weatherproof Windows
how-to-remove-wood-stain,How to Remove Wood Stain
how-to-install-an-afci-breaker,How to Install an AFCI Breaker
salt-rock-for-grilling,Salt Rock for Grilling
i-love-you-mason-jars,I Love You Mason Jars
how-to-install-bifold-doors,How to Install Bifold Doors
how-to-start-a-chainsaw,How to Start a Chainsaw
how-to-use-a-leaf-blower,How to Use a Leaf Blower 
how-to-install-a-toilet-seat,How to Install a Toilet Seat
how-to-make-a-plant-hanger,How to Make a Plant Hanger
how-to-build-diy-harvest-yard-signs,How to Build DIY Harvest Yard Signs
how-to-fix-squeaky-floors,How to Fix Squeaky Floors
how-to-use-an-obd2-scanner,How to Use an OBD2 Scanner
how-to-repair-concrete-steps,How to Repair Concrete Steps
how-to-clean-painted-walls,How to Clean Painted Walls
how-to-install-barn-doors,How to Install Barn Doors
how-to-use-a-rain-barrel,How to Use a Rain Barrel
how-to-crimp-connectors,How to Crimp Connectors
how-to-plan-an-outdoor-kitchen,How to Plan an Outdoor Kitchen
how-to-vacuum-a-pool,How to Vacuum a Pool
how-to-hang-a-plant,How to Hang a Plant from the Ceiling
how-to-carve-a-pumpkin,How to Carve a Pumpkin
how-to-use-a-paint-sprayer,How to Use a Paint Sprayer
how-to-care-for-poinsettias,How to Care for Poinsettias
i-love-you-collage,I Love You Collage
how-to-unclog-a-toilet,How to Unclog a Toilet
how-to-clean-a-chimney,How to Clean a Chimney
how-to-build-a-vertical-garden-with-terra-cotta-pots,How to Build a Vertical Garden with Terra Cotta Pots
how-to-stain-butcher-block,How to Stain Butcher Block
how-to-screen-in-a-porch,How to Screen in a Porch
how-to-makeover-your-laundry-room,How to Make Over Your Laundry Room
how-to-install-horizontal-blinds,How to Install Horizontal Blinds
how-to-clean-granite-countertops,How to Clean Granite Countertops
how-to-clean-a-dryer-vent,How to Clean a Dryer Vent
hanging-curtains-from-the-ceiling,Hanging Curtains from the Ceiling
how-to-install-a-ballcock-fill-valve,How To Install a Ballcock Fill Valve
how-to-clean-a-freezer,How to Clean a Freezer
how-to-grow-succulents,How to Grow Succulents
how-to-replace-a-bathroom-faucet,How to Replace a Bathroom Faucet
how-to-clean-a-microfiber-couch,How to Clean a Microfiber Couch
how-to-clean-blinds,How to Clean Blinds
how-to-paint-tiles,How to Paint Tiles
how-to-build-a-staircase,How to Build a Staircase
how-to-clean-an-espresso-machine,How to Clean an Espresso Machine
how-to-pack-pictures-and-mirrors,How to Pack Pictures and Mirrors
how-to-make-a-christmas-pinecone-wreath,How to Make a Pinecone Christmas Wreath
how-to-test-fuel-injectors,How to Test Fuel Injectors
how-to-use-a-car-jack,How to Use a Car Jack and Jack Stands
how-to-grill-chicken,How to Grill Chicken
how-to-use-a-charcoal-grill,How to Use a Charcoal Grill
how-to-cut-glass,How to Cut Glass
how-to-set-a-pattern-in-floor-tile,How to Set a Pattern in Floor Tile
how-to-clean-a-coffee-maker,How to Clean a Coffee Maker
how-to-sand-drywall,How to Sand Drywall
how-to-make-a-mini-pumpkin-patch,How to Make a Mini Pumpkin Patch
wiring-a-thermostat,How to Wire a Thermostat
how-to-drill-into-concrete,How to Drill Into Concrete
how-to-clean-a-cast-iron-skillet,How to Clean a Cast Iron Skillet
how-to-make-a-holiday-evergreen-chandelier,How to Make a Holiday Evergreen Chandelier
how-to-repair-cracks-in-a-concrete-driveway,How to Repair Cracks in a Concrete Driveway
how-to-fix-a-leaking-toilet-base,How to Fix a Leaking Toilet Base
how-to-create-a-succulent-birdbath-planter,How to Create a Succulent Birdbath Planter
how-to-bend-tube-and-pipe,How to Bend Tube and Pipe
how-to-install-recessed-lighting-on-sloped-ceilings,How to Install Recessed Lighting on Sloped Ceilings
how-to-build-utility-shelves,How to Build Utility Shelves
how-to-make-a-burlap-wreath,How to Make a Burlap Wreath
how-to-create-a-container-garden,How to Create a Container Garden
how-to-jump-start-a-car,How to Jump-Start a Car
how-to-weatherproof-your-front-door,How to Weatherproof Your Front Door
how-to-wire-a-hot-tub,How to Wire a Hot Tub
how-to-conceal-electrical-wires-with-crown-moulding,How to Conceal Electrical Wires with Crown Moulding
how-to-care-for-roses-in-summer,How to Care for Roses in Summer
how-to-fix-a-noisy-ceiling-fan-,How to Fix a Noisy Ceiling Fan 
how-to-paint-paneling,How to Paint Paneling
how-to-make-a-home-more-sustainable,How to Make a Home More Sustainable
how-to-clean-grout,How to Clean Grout
helpful-move-in-checklist-for-landlords,Helpful Move-In Checklist for Landlords
how-to-hang-a-wallpaper-border,How to Hang a Wallpaper Border
how-to-build-a-backyard-tic-tac-to-game,How to Build a Backyard Tic Tac Toe Game
how-to-install-a-flood-light,How to Install a Flood Light
how-to-inflate-balloons-with-baking-soda,How to Inflate Balloons with Baking Soda
how-to-get-rid-of-crickets,How to Get Rid of Crickets
how-to-lay-envirotile,How to Lay Envirotile
how-to-fertilize-your-lawn,How to Fertilize Your Lawn
how-to-plant-a-hanging-basket,How to Plant a Hanging Basket
how-to-make-a-whiskey-barrel-planter,How to Make a Whiskey Barrel Planter​
how-to-make-a-90-degree-rumblestone-planter,How to Make a 90-Degree Rumblestone Planter
how-to-remove-a-door-knob,How to Remove a Door Knob
how-to-light-a-pilot-light,How to Light a Pilot Light
garden-style-diy-cement-and-copper-pots,Garden Style: DIY Cement and Copper Pots
how-to-fix-a-broken-drawer,How to Fix a Broken Drawer
how-to-replace-a-sink-sprayer,How to Replace a Sink Sprayer
how-to-replace-a-thermocouple,How to Replace a Thermocouple
how-to-use-a-snow-blower,How to Use a Snow Blower
how-to-install-a-flush-valve,How to Install a Flush Valve
how-to-stain-concrete,How to Stain Concrete
how-to-whitewash-brick,How to Whitewash Brick
how-to-make-a-topiary,How to Make a Topiary
citrus-tree-problems-how-to-check-for-health,Citrus Tree Problems: How to Check for Health
hanging-centerpiece-diy-succulent-ball,Hanging Centerpiece: DIY Succulent Ball
how-to-install-a-closetmaid-shelftrack-closet-storage-system,How to Install a ClosetMaid ShelfTrack Closet Storage System
how-to-clean-shower-curtains,How to Clean Shower Curtains
how-to-fix-a-leaky-faucet,How to Fix a Leaky Faucet
how-to-prepare-for-a-fire-emergency,How to Prepare for a Fire Emergency
how-to-make-sidewalk-art,How to Make Sidewalk Art 
succulent-dish-garden-ideas,Succulent Dish Garden Ideas
how-to-build-a-crate-end-table,How to Make a Table From A Wooden Crate
how-to-install-a-towel-bar,How to Install a Towel Bar 
how-to-build-stairs,How to Build Stairs
how-to-can-tomatoes,How to Can Tomatoes
how-to-organize-a-fridge,How to Organize a Fridge
sunken-garden-ideas,Sunken Garden Ideas
diy-veggie-garden-trellis,DIY Veggie Garden Trellis
how-to-move-a-couch,How to Move a Couch
how-to-change-spark-plugs,How to Change Spark Plugs
how-to-install-a-truck-tool-box:-an-installation-guide,How to Install a Truck Tool Box: An Installation Guide
how-to-replace-a-sink-trap,How to Replace a Sink Trap
how-to-clean-a-fireplace,How to Clean a Fireplace
how-to-plant-flowers,How to Plant Flowers
how-to-prepare-a-subfloor-for-tile-installation,How to Prepare a Subfloor for Tile Installation
commercial-floor-care-tips-for-businesses-,Commercial Floor Care Tips for Businesses 
how-to-measure-for-a-ceiling-fan,How to Measure for a Ceiling Fan
preserve-your-herbs-diy-drying-rack,Preserve Your Herbs: DIY Drying Rack
the-best-ice-cream-makers-for-homemade-frozen-treats,The Best Ice Cream Makers for Homemade Frozen Treats
how-to-build-a-vertical-garden-wall,How to Build a Vertical Garden Wall
how-to-use-a-circular-saw,How to Use a Circular Saw
how-to-make-a-light-box-for-growing-seedlings,How to Make a Light Box for Growing Seedlings
how-to-fix-a-toilet-tank,How to Fix a Toilet Tank
how-to-change-windshield-wipers,How to Change Windshield Wipers
how-to-build-a-wooden-headboard,How to Build a Wooden Headboard
how-to-install-closet-shelves,How to Install Closet Shelves
how-to-plant-potatoes,How to Plant Potatoes
how-to-weatherize-your-home,How to Weatherize Your Home
make-a-wood-dowel-christmas-tree,Make a Wood Dowel Christmas Tree
how-to-find-a-wall-stud,How To Find A Wall Stud
how-to-prepare-a-room-for-paint,How to Prepare a Room for Paint
how-to-carve-a-pumpkin,How to Carve a Pumpkin
building-a-deck-how-to-choose-a-site-for-your-deck,Building a Deck: How to Choose a Site for Your Deck
made-for-shade-diy-umbrella-stand-planter,Made for Shade: DIY Umbrella Stand Planter
how-to-clean-tile-floors,How to Clean Tile Floors
how-to-install-a-storm-door,How to Install a Storm Door
how-to-make-a-terra-cotta-santa-pot,How to Make a Terra Cotta Santa Pot
how-to-replace-ceiling-fan-blades-,How to Replace Ceiling Fan Blades 
how-to-measure-curtains,How to Measure Curtains
how-to-pack-books,How to Pack Books
ceiling-fan-remote-troubleshooting,Ceiling Fan Remote Troubleshooting
how-to-treat-a-bee-sting,How to Treat Bee Stings
how-to-use-a-torque-wrench,How to Use a Torque Wrench
how-to-remove-carpet,How to Remove Carpet
how-to-prepare-for-an-earthquake-,How to Prepare for an Earthquake 
how-to-make-a-christmas-globe,How to Make a Christmas Globe
how-to-make-a-monogram-garland-wreath,How to Make a Monogram Garland Wreath
how-to-make-a-diy-trick-or-treat-sign-,How to Make a DIY Trick or Treat Sign 
how-to-remove-tiles,How to Remove Tiles
how-to-fix-paint-chips-on-a-wall,How to Fix Paint Chips on a Wall
how-to-install-a-shower-pan,How To Install a Shower Pan
how-to-replace-a-bathtub-faucet,How to Replace a Bathtub Faucet
how-to-mulch-your-yard,How to Mulch Your Yard
how-to-sharpen-lawn-mower-blades,How to Sharpen Lawn Mower Blades
build-a-tic-tac-toe-game,Build a Tic-Tac-Toe Game
how-to-remove-a-kitchen-faucet,How to Remove a Kitchen Faucet
how-to-clean-vinyl-floors,How to Clean Vinyl Floors
how-to-replace-recessed-lighting-with-led,How to Replace Recessed Lighting with LED
how-to-create-a-diy-baking-station,How to Create a DIY Baking Station
how-to-restore-a-deck,How to Restore a Deck
how-to-troubleshoot-your-christmas-tree,How to Troubleshoot Your Christmas Tree
how-to-clean-a-hot-tub,How to Clean a Hot Tub
diy-recipe-box,DIY Recipe Box
how-to-clean-kitchen-appliances,How to Clean Kitchen Appliances
how-to-clean-a-cutting-board,How to Clean a Cutting Board
pool-water-testing,Pool Water Testing
how-to-make-playdough,How to Make Playdough 
how-to-make-a-pendulum-painting,How to Make a Pendulum Painting
how-to-install-a-security-camera,How To Install A Security Camera
how-to-make-a-diy-stenciled-plant-pot,How to Make a DIY Stenciled Plant Pot 
how-to-clean-a-humidifier,How to Clean a Humidifier
how-to-fix-a-leaky-roof,How to Fix a Leaky Roof
how-to-make-a-seed-starter-shelf,How to Make Indoor Seed Starter Shelves
how-to-clean-stainless-steel,How to Clean Stainless Steel
how-to-move-a-refrigerator,How to Move a Refrigerator
how-to-make-a-patio-drink-stand,How to Make a Patio Drink Stand
how-to-paint-exterior-windows,How to Paint Exterior Windows
how-to-change-an-outdoor-light-fixture,How to Change an Outdoor Light Fixture on Different Types of Siding
how-to-replace-valve-seats,How to Replace Valve Seats
how-to-make-a-rosemary-wreath,How to Make a Rosemary Wreath
diy-fish-tank-terrarium,DIY Fish Tank Terrarium
how-to-measure-a-refrigerator,How to Measure a Refrigerator
how-to-clean-a-vacuum,How to Clean a Vacuum
how-to-remove-a-toilet,How to Remove a Toilet
how-to-make-a-christmas-ornament-tree,How to Make a Christmas Ornament Tree
how-to-remove-ceramic-tile,How to Remove Ceramic Tile
how-to-grow-pears,How to Grow Pears
how-to-read-a-micrometer,How to Read a Micrometer
diy-hypertufa-planters,DIY Hypertufa Planters
roof-rack-installation-step-by-step-guide,Roof Rack Installation Step by Step Guide
how-to-install-parquet-tile,How to Install Parquet Tile
how-to-bleed-brakes,How to Bleed Brakes
how-to-hang-shelves,How to Hang Shelves
how-to-replace-a-fill-valve,How to Replace a Fill Valve
how-to-caulk,How to Caulk Like a Professional
how-to-use-a-caulk-gun,How to Use a Caulk Gun
how-to-replace-a-deck-railing,How to Replace a Deck Railing
how-to-make-a-christmas-craft-board,How to Make a Christmas Craft Board
how-to-install-a-whole-house-water-filter,How to Install a Whole House Water Filter
give-plants-a-lift-diy-mini-plant-stand,Give Plants a Lift: DIY Mini Plant Stand
how-to-build-a-concrete-tray,How to Build a Concrete Tray
string-trimmer-maintenance,String Trimmer Maintenance
diy-stock-tank-pool,DIY Stock Tank Pool
dishwasher-not-drying,Top Reasons Your Dishwasher Isn't Drying
how-to-make-a-worm-bin,How to Make a Worm Bin
how-to-replace-cabinet-hinges,How to Replace Cabinet Hinges
how-to-cut-crown-moulding,How to Cut Crown Moulding
how-to-make-a-hose-guide-to-protect-your-flowers,How to Make a Hose Guide to Protect Your Flowers
how-to-make-a-veggie-caddy,How to Make a Veggie Caddy
how-to-get-a-splinter-out,How to Get a Splinter Out
how-to-install-shut-off-valves,How to Install Shut-Off Valves
how-to-clean-a-keurig,How to Clean a Keurig
how-to-use-a-charcoal-chimney,How to Use a Charcoal Chimney 
finishing-outside-corners,Finishing Outside Corners
diy-coin-display,DIY Coin Display
diy-rain-barrels,DIY Rain Barrels
how-to-hang-a-heavy-mirror,How to Hang a Heavy Mirror
how-to-use-chalked-paint,How to Use Chalked Paint
how-to-move-a-piano,How to Move a Piano
how-to-weld-aluminum,How to Weld Aluminum
how-to-wire-a-3-way-switch,How to Wire a 3-Way Switch
build-a-wooden-crate-storage-ottoman,Build a Wooden Crate Storage Ottoman
how-to-make-a-basket-wreath,How to Make a Basket Wreath
how-to-build-a-fire-pit,How to Build a Fire Pit
how-to-grow-onions,How to Grow Onions
what-to-plant-for-spring,What to Plant for Spring
diy-wall-shelves,DIY Wall Shelves
how-to-install-a-sliding-door,How to Install a Sliding Door
how-to-hang-christmas-lights,How to Hang Christmas Lights
grill-a-steak,How to Grill a Steak
how-to-build-raised-garden-beds,How to Build a Raised Garden Bed
how-to-make-a-bed,How to Make a Bed
how-to-install-hardwood-flooring,How To Install Hardwood Flooring
how-to-make-a-wooden-plant-stand,How to Make a Wooden Plant Stand
how-to-get-rid-of-fire-ants,How to Get Rid of Fire Ants
how-to-build-a-key-holder,How to Build a Key Holder
DIY-holiday-pallet,Christmas Tree Holiday Pallet Decoration
how-to-grow-your-own-vegetable-garden,How to Grow Your Own Vegetable Garden
how-to-get-rid-of-thrips,How to Get Rid of Thrips
how-to-pack-shoes-for-moving,How to Pack Shoes for Moving
your-no-fail-guide-to-a-grime-free-oven,Your No-Fail Guide to A Grime-Free Oven
how-to-hang-drywall,How to Hang Drywall
how-to-install-a-dog-door,How to Install a Dog Door
how-to-build-a-nightstand-organizer,How to Build a Nightstand Organizer
