slug,title
how-to-build-a-diy-butterfly-feeder,How to Build a DIY Butterfly Feeder
how-to-build-a-diy-outdoor-coffee-table,How to Build a DIY Outdoor Coffee Table
lawn-mower-maintenance,Lawn Mower Maintenance
how-to-connect-faucets-with-supply-tubes,How to Connect Faucets with Supply Tubes
how-to-install-carpet-tiles,How to Install Carpet Tiles
DIY-closet-organizer,DIY Closet Organizer
how-to-clean-a-dishwasher,How to Clean a Dishwasher
how-to-fix-christmas-tree-lights,How to Fix Christmas Lights
how-to-build-a-loft-bed,How to Build a Loft Bed
how-to-make-a-mosaic-tile-mirror,How to Make a Mosaic Tile Mirror
diy-tiered-flowerpots,DIY Tiered Flowerpots
how-to-grow-tomatoes,How to Grow Tomatoes
how-to-build-a-dog-food-station,How to Build a Dog Food Station
how-to-make-a-succulent-garden-frame,How to Make a Succulent Garden Frame
how-to-install-a-kitchen-faucet,How To Install a Kitchen Faucet
how-to-build-a-tv-stand,How to Build a TV Stand
how-to-make-a-planter-wall,How to Make a Planter Wall
diy-cat-tree,DIY Cat Tree
how-to-build-a-flower-tower,How to Build a Flower Tower
how-to-replace-a-shower-faucet,How to Replace a Shower Faucet
how-to-grow-apples,How to Grow Apples
how-to-make-a-diy-football-toss-game,How to Make a DIY Football Toss Game
how-to-create-a-diy-lighted-wooden-pumpkin,How to Create a DIY Lighted Wooden Pumpkin
how-to-pack-dishes-and-glasses,How to Pack Dishes and Glasses
how-to-hang-wallpaper-borders,How to Hang Wallpaper Borders
how-to-make-a-hanging-grill-shelf,How to Make a Hanging Grill Shelf
how-to-move-a-mattress,How to Move a Mattress
how-to-make-a-wood-stocking-door-hanger,How to Make a Wood Stocking Door Hanger
make-a-farmhouse-style-moss-cone,Make a Farmhouse Style Moss Cone
how-to-make-a-santa-gnome,How to Make a Santa Gnome
how-to-use-a-pressure-washer,How to Use a Pressure Washer 
how-to-tape-and-mud-drywall,How to Tape and Mud Drywall
how-to-build-a-picnic-table-with-a-built-in-cooler,How to Build a Picnic Table with a Built-In Cooler
how-to-lay-floor-tiles,How to Lay Floor Tiles
how-to-build-a-wall-plant-hanger,How to Build a Wall Plant Hanger
diy-address-sign-planter,DIY Address Sign Planter
how-to-build-a-christmas-countdown-calendar,How to Build a Christmas Countdown Calendar
how-to-paint-furniture,How to Paint Furniture
how-to-install-vanity-lights,How to Install Vanity Lights
how-to-clean-gutters,How to Clean Gutters
how-to-install-base-cabinets,How to Install Base Cabinets
how-to-install-wall-cabinets,How to Install Wall Cabinets
how-to-use-a-smoker,How to Use a Smoker
how-to-make-a-diy-wood-block-santa,How to Make a DIY Wood Block Santa 
how-to-flush-a-radiator,How to Flush a Radiator
how-to-clean-a-kitchen,How to Clean a Kitchen
diy-wood-tray,DIY Wood Tray
how-to-build-a-wire-fence,How to Build a Wire Fence
how-to-clean-silver-10-ways,How to Clean Silver 10 Ways
how-to-make-a-cornhole-board,How to Make a Cornhole Board
how-to-install-a-pool-filter,How to Install a Pool Filter
affordable-kitchen-updates,Affordable Kitchen Updates
how-to-hang-plates-on-a-wall,How to Hang Plates on a Wall
pumpkin-decorating-ideas,Pumpkin Decorating Ideas
how-to-install-a-french-drain,How to Install a French Drain
diy-window-box,DIY Window Box
how-to-make-a-succulent-wreath,How To Make a Succulent Wreath
how-to-plant-a-tree,How to Plant a Tree 
how-to-spring-clean,How to Spring Clean
how-to-make-a-vegetable-stand,How to Make a Vegetable Stand
garage-door-maintenance-tips,Garage Door Maintenance Tips
diy-backyard-putting-green,DIY Backyard Putting Green
how-to-grow-avocados,How to Grow Avocados
how-to-make-a-solar-oven,How to Make a Solar Oven
how-to-sharpen-a-chainsaw,How to Sharpen a Chainsaw
diy-barn-door,DIY Barn Door 
how-to-build-retaining-wall,How to Build a Retaining Wall
how-to-build-a-rocket-growth-chart,How to Build a Rocket Growth Chart
how-to-make-a-house-number-planter,How to Make a House Number Planter​
how-to-put-on-a-duvet-cover,How to Put on a Duvet Cover
how-to-build-a-storage-ottoman,How to Build a Storage Ottoman
how-to-install-cement-board,How to Install Cement Board
garage-storage-ideas,Garage Storage Ideas
how-to-install-smoke-alarms,How to Install Smoke Alarms
how-to-paint-terra-cotta-pots,How to Paint Terra Cotta Pots
diy-compost-bin,DIY Compost Bin
how-to-install-butcher-block-countertops,How to Install Butcher Block Countertops
how-to-remove-a-bathtub-drain,How to Remove a Bathtub Drain
how-to-make-a-rope-shelf,How to Make a Rope Shelf
how-to-install-a-medicine-cabinet,How to Install a Medicine Cabinet
outdoor-fire-pit-ideas,10 Sizzling Hot Outdoor Fire Pit Spaces
how-to-build-an-outdoor-privacy-wall,How to Build an Outdoor Privacy Wall
how-to-decorate-for-christmas-with-lights,How to Decorate for Christmas with Lights
how-to-use-a-table-saw,How to Use a Table Saw
diy-vegetable-stand,DIY Vegetable Stand
how-to-make-a-milk-carton-bird-house,How to Make a Milk Carton Bird House
how-to-create-a-diy-house-lantern,How to Create a DIY House Lantern
how-to-install-a-widespread-faucet,How to Install a Widespread Faucet
how-to-make-sugar-skull-halloween-flowerpots,How to Make Sugar Skull Halloween Flower Pots
how-to-build-a-picnic-table,How to Build a Picnic Table
how-to-build-a-rustic-decorative-pumpkin-stand,How to Build a Rustic Decorative Pumpkin Stand
how-to-install-a-pivot-shower-door,How To Install a Pivot Shower Door
how-to-build-a-pond,How to Build a Pond
diy-garage-shelves,DIY Garage Shelves
how-to-clean-countertops,How to Clean Countertops
how-to-make-hypertufa-pots,How to Make Hypertufa Pots
how-to-install-kitchen-cabinets,How to Install Kitchen Cabinets
how-to-make-a-cutting-board,How to Make a Cutting Board
how-to-install-under-cabinet-lighting,How to Install Under Cabinet Lighting
how-to-build-a-wooden-storage-bench,How to Build a Wooden Storage Bench
how-to-fix-a-garbage-disposal,How to Fix a Garbage Disposal
how-to-make-wood-joints,How to Make Wood Joints
diy-decorative-wheelbarrow,DIY Decorative Wheelbarrow​
how-to-build-an-adirondack-chair,How to Build a DIY Adirondack Chair
how-to-install-a-direct-to-stud-shower-enclosure,How to Install a Direct-to-Stud Shower Enclosure
diy-hanging-gutter-planter,DIY Hanging Gutter Planter​
how-to-install-shiplap,How to Install Shiplap  
build-a-DIY-kids-sprinkler,Build a DIY Kids Sprinkler
how-to-install-laminate-countertops,How to Install Laminate Countertops
how-to-install-a-toilet,How to Install a Toilet
how-to-make-an-address-display-planter,How to Make an Address Display Planter
how-to-make-a-diy-battleship,How to Make a DIY Battleship
how-to-install-a-tile-backsplash,How to Install a Tile Backsplash
how-to-install-baseboard,How to Install Baseboard
how-to-make-burlap-pumpkins,How to Make Burlap Pumpkins
how-to-create-halloween-yard-decor,How to Create Halloween Yard Decor
how-to-build-a-resin-shed-kit,How to Build a Resin Shed Kit
how-to-transform-a-piece-of-furniture-with-paint,How to Transform a Piece of Furniture with Paint
how-to-install-a-pocket-door,How to Install a Pocket Door 
how-to-build-a-raised-deck,How to Build a Raised Deck
how-to-distress-wood,How to Distress Wood
how-to-build-a-diy-cheeseboard,How to Build a DIY Cheeseboard
how-to-clean-a-ceiling-fan,How to Clean a Ceiling Fan
how-to-build-a-vertical-succulent-garden,How to Build a Vertical Succulent Garden
how-to-build-a-window-box-planter,How to Build a Window Box Planter
how-to-build-a-greenhouse,How to Build a Greenhouse
how-to-build-a-walkway,How to Build a Walkway
how-to-remove-paint-from-wood,How to Remove Paint From Wood 
how-to-build-a-block-wall,How to Build a Block Wall
how-to-make-diy-textured-art,How to Make DIY Textured Art 
how-to-get-rid-of-crabgrass,How to Get Rid of Crabgrass
how-to-replace-a-power-cord-plug,How to Replace a Power Cord Plug
how-to-build-a-bookshelf,How to Build a Bookshelf
how-to-create-a-deluxe-cardboard-playhouse,How to Create a Deluxe Cardboard Playhouse
hampton-bay-ceiling-fan-troubleshooting-guide,Hampton Bay Ceiling Fan Troubleshooting Guide
how-to-detail-a-car,How to Detail a Car
how-to-build-a-decorative-fall-topiary,How to Build a Decorative Fall Topiary
simple-steps-to-clean-up-your-backyard,Simple Steps to Clean Up Your Yard
how-to-remove-and-replace-a-bathtub,How to Remove and Replace a Bathtub
how-to-make-a-chicken-wire-frame,How To Make a Chicken Wire Frame
diy-desk,DIY Desk
how-to-install-metal-roofing,How to Install Metal Roofing
how-to-change-a-tire,How to Change a Tire
how-to-make-a-flower-pot-scarecrow,How to Make a Flower Pot Scarecrow
how-to-build-an-outdoor-kitchen,How to Build an Outdoor Kitchen
how-to-make-a-metal-snowflake-advent-calendar,How to Make a Metal Snowflake Advent Calendar
diy-dehydrator,DIY Dehydrator
diy-bar-cart,DIY Bar Cart
diy-fall-kids-crafts,DIY Fall Kids Crafts
how-to-build-a-diy-dog-house,How to Build a DIY Dog House
how-to-build-a-birdhouse,How to Build a Birdhouse
how-to-paint-kitchen-cabinets,How to Paint Kitchen Cabinets
how-to-sponge-paint,How to Sponge Paint
how-to-remove-and-replace-a-bathtub-,How To Remove and Replace a Bathtub 
how-to-build-a-medal-display-case,How To Build A Medal Display Case
build-a-kids-soccer-game,Build a Kids Soccer Game
how-to-iron-a-shirt,How to Iron a Shirt
how-to-cut-tiles,How to Cut Tiles
how-to-solder-copper-pipes,How To Solder Copper Pipes
how-to-mig-weld,How to MIG Weld
diy-outdoor-projection-screen,DIY Outdoor Projection Screen
diy-potting-bench,DIY Potting Bench
how-to-remodel-a-bathroom,How to Remodel a Bathroom
how-to-make-a-tree-charcuterie-board,How to Make a Tree Charcuterie Board
DIY-grill-station,DIY Grill Station
how-to-make-a-birdhouse-planter,How to Make a Birdhouse Planter
how-to-install-a-smoke-detector,How To Install a Smoke Detector
how-to-install-a-mailbox,How to Install a Mailbox
how-to-press-flowers,How to Press Flowers
best-houseplants-for-your-home-or-office,Best Indoor Plants for Your Home or Office
how-to-build-a-kids-cubby,How to Build a Kids Cubby 
how-to-install-a-glue-up-shower-enclosure,How to Install a Glue-Up Shower Enclosure
how-to-lay-out-tile,How to Lay Tile
front-yard-landscaping-ideas,Front Yard Landscaping Ideas
how-to-build-a-diy-toy-box,How to Build a DIY Toy Box
how-to-install-tile-floor,How to Install a Tile Floor
how-to-create-a-personalized-lazy-susan-tray,How to Create a Personalized Lazy Susan Tray
how-to-install-an-exterior-door,How to Install an Exterior Door
how-to-install-a-chain-link-fence,How to Install a Chain Link Fence
how-to-install-a-two-handle-kitchen-faucet,How To Install a Two Handle Kitchen Faucet
how-to-build-a-murphy-bed,How to Build a Murphy Bed
how-to-install-landscape-lighting,How to Install Landscape Lighting
how-to-build-a-chicken-coop,How to Build a Chicken Coop
how-to-finish-wood-101-a-wood-finishing-guide,How To Finish Wood 101: A Wood Finishing Guide
how-to-create-a-pie-stand-and-pie-puzzle,How to Create a Pie Stand and Pie Puzzle
how-to-make-a-santa's-treats-tray,How to Make a Santa's Treats Tray 
how-to-build-a-treehouse,How to Build a Treehouse
how-to-build-a-kids-toy-crane,How to Build a Kids Toy Crane 
how-to-read-calipers,How to Read Calipers
how-to-make-a-christmas-tree-dress,How to Make a Christmas Tree Dress
diy-garden-cart,DIY Garden Cart
how-to-make-soap,How to Make Soap
build-a-kids-combination-locker,Build a Kids Combination Locker
how-to-build-a-kids-ladder-truck,How to Build a Kids Ladder Truck
video-how-to-make-kokedama,Video: How to Make Kokedama
how-to-divide-perennials,How to Divide Perennials
how-to-install-bird-netting,How To Install Bird Netting
video-growing-succulents,Video: Growing Succulents
infographic-what-is-the-best-orchid-for-you,Infographic: What Is the Best Orchid for You?
advice-when-to-prune-trees,Advice: When to Prune Trees
safe-footing-for-garden-paths,Safe Footing for Garden Paths
how-to-plant-bulbs-in-fall,How to Plant Bulbs in Fall
how-to-water-new-trees-and-shrubs-during-a-dry-spell, How to Water New Trees and Shrubs During a Dry Spell
how-to-boost-fall-blooms,How to Boost Fall Blooms
how-to-feed-peppers-and-tomatoes,How to Feed Peppers and Tomatoes
goat-cheese-stuffed-chicken-breasts-with-cranberry-salsa-recipe,Goat Cheese Stuffed Chicken Breasts with Cranberry Salsa Recipe
deer-resistant-flowers-daffodils,Deer Resistant Flowers: Daffodils
how-to-get-rid-of-grubs,How to Get Rid of Grubs
recipe-steak-fajitas-with-grilled-bell-peppers-and-portobello,Recipe: Steak Fajitas With Grilled Bell Peppers and Portobello
fall-tree-and-shrub-ideas,Fall Tree and Shrub Ideas
time-to-treat-for-insects-that-kill-your-garden-plants,Time to Treat for Insects that Kill Your Garden Plants
how-to-plant-palm-trees,How to Plant Palm Trees
edible-container-gardening,Edible Container Gardening
how-to-spot-treat-weeds,How to Spot Treat Weeds
how-to-disbud-camellias,How to Disbud Camellias
how-to-plant-sweetshrub-and-tea-olive-for-fragrance,How to Plant Sweetshrub and Tea Olive for Fragrance
recipe-grilled-vegetable-skewers-with-corn-zucchini-and-eggplant,"Recipe: Grilled Vegetable Skewers With Corn, Zucchini and Eggplant"
how-to-grow-african-violets,How to Grow African Violets
how-to-put-the-vegetable-garden-to-bed-for-the-winter,How to Put the Vegetable Garden to Bed for the Winter
how-to-grow-primrose,How to Grow Primrose
add-a-last-blast-of-color-indoors,Add a Last Blast of Color Indoors
how-to-fertilize-and-mulch-berries,How to Fertilize and Mulch Berries
accent-landscaping-for-a-personalized-garden,Accent Landscaping for a Personalized Garden
butternut-squash-with-candied-pecans-recipe,Butternut Squash with Candied Pecans Recipe
how-to-design-a-container-garden,How to Design a Container Garden
how-to-protect-trees-and-shrubs-for-winter,How to Protect Trees and Shrubs for Winter
recipe-make-sweet-potato-and-carrot-puree,Recipe: Make Sweet Potato and Carrot Puree
water-wise-plant-choices,Water-Wise Plant Choices
best-places-in-your-home-for-houseplants,Best Places in Your Home for Houseplants
how-to-plan-your-garden-for-spring,How to Plan Your Garden for Spring
how-to-grow-privacy-shrubs​,How to Grow Privacy Shrubs
best-time-to-plant-fall-veggies,Best Time to Plant Fall Veggies
leaking-money-through-a-hose-or-sprinkler-test-repair-replace,"Leaking Money Through a Hose or Sprinkler? Test, Repair, Replace."
how-to-harvest-leaves-for-mulch,How to Harvest Leaves for Mulch
staying-safe-with-natural-gas,Staying Safe with Natural Gas
how-to-encourage-more-rose-blooms,How to Encourage More Rose Blooms
how-to-care-for-palm-trees,How to Care for Palm Trees
outdoor-fall-decoration-ideas,Outdoor Fall Decoration Ideas
how-to-grow-indoor-trees,How to Grow Indoor Trees
how-to-plant-drought-smart-succulents,How to Plant Drought Smart Succulents
how-to-improve-soil-in-flower-beds,How to Improve Soil in Flower Beds
types-of-sheds,Types of Sheds
how-to-grow-camellias,How to Grow Camellias
planting-fall-bulbs,Planting Fall Bulbs
repetition-matters-in-the-landscape,Repetition Matters in the Landscape
how-to-use-cacti-and-succulents-in-bare-spots,How to Use Cacti and Succulents in Bare Spots
create-a-shady-haven,Create a Shady Haven
annual-flowering-plants-for-spring,Annual Flowering Plants for Spring
how-to-grow-peonies,How to Grow Peonies
how-to-fill-bare-spots-in-your-garden-with-containers,How to Fill Bare Spots in Your Garden with Containers
faux-paint-finish-ideas, Faux Paint Finish Ideas
turkey-gets-a-fresh-herb-makeover,Turkey Gets a Fresh Herb Makeover
refresh-beds-between-plantings,Refresh Beds Between Plantings
how-to-test-veggie-garden-soil,How to Test Veggie Garden Soil
tips-for-growing-a-greener-lawn-in-the-south,Tips for Growing a Greener Lawn in the South
patio-maintenance-tips,Patio Maintenance Tips
fire-prevention-create-a-fire-safe-environment-on-your-property,Fire Prevention: Create a Fire-Safe Environment on Your Property
recipe-grilled-corn-salad-with-poblano-peppers,Recipe: Grilled Corn Salad With Poblano Peppers
how-to-kill-weeds-in-your-lawn,How to Kill Weeds in Your Lawn
how-to-care-for-lilies,How to Care for Lilies
privacy-landscaping-ideas,Privacy Landscaping Ideas
best-way-to-divide-perennials,Best Way to Divide Perennials
types-of-tool-handles,The Long and Short of Tool Handles
best-shade-trees-for-a-cool-yard,Best Shade Trees for a Cool Yard
how-to-grow-tropical-plants,How to Grow Tropical Plants
how-to-keep-pets-out-of-compost,How to Keep Pets Out of Compost
how-to-harvest-and-store-compost,How to Harvest and Store Compost
how-to-kill-weeds,How to Kill Weeds
garden-memorial-ideas,Garden Memorial Ideas
4-tricks-for-planting-tulip-bulbs,4 Tricks for Planting Tulip Bulbs
find-everything-you-need-inside-the-home-depot-store,How to Find Everything You Need Inside The Home Depot 
how-to-overwinter-herbs,How to Overwinter Herbs
how-to-prune-flowers,How to Prune Flowers
how-to-install-a-rain-chain,How to Install a Rain Chain
how-to-trap-stink-bugs,How to Trap Stink Bugs
9-last-minute-mothers-day-gardening-gift-ideas,9 Last-Minute Mother’s Day Gardening Gift Ideas
find-your-usda-plant-hardiness-zone,Find Your USDA Plant Hardiness Zone
winter-garden-ideas-for-warmer-climates,Winter Garden Ideas for Warmer Climates
perennials-to-divide-in-fall​,Perennials to Divide in Fall
tips-to-grow-and-store-pumpkins,Tips to Grow and Store Pumpkins
how-to-protect-berries-from-animals,How to Protect Berries from Animals
how-to-grow-sprouted-seeds-and-microgreens,How to Grow Sprouted Seeds and Microgreens
how-and-when-to-pinch-mums-and-poinsettias,How and When to Pinch Mums and Poinsettias
5-ways-to-protect-your-garden-from-frost-and-freeze-damage,5 Ways to Protect Your Garden From Frost and Freeze Damage
how-to-pick-berries,How to Pick Berries
how-to-grow-jasmine-and-mandevilla,How to Grow Jasmine and Mandevilla
video-how-to-build-a-chicken-coop-parts-1-and-2,"Video: How to Build a Chicken Coop, Parts 1 and 2"
perfect-companion-plants-for-hosta,Perfect Companion Plants for Hosta
how-to-increase-blooms-on-perennial-flowers,How to Increase Blooms on Perennial Flowers
how-to-care-for-orchids,How to Care for Orchids
indoor-herb-garden-ideas,Indoor Herb Garden Ideas
plant-salvia-for-summer-bloom,Plant Salvia for Summer Bloom
how-to-prune-tropical-shrubs-and-hedges,How to Prune Tropical Shrubs and Hedges
recipe-zesty-ribs-on-the-grill,Recipe: Zesty Ribs on the Grill
how-to-make-a-tropical-container-with-rio-dipladenias,How to Make a Tropical Container with Rio Dipladenias
get-to-know-red-hot-and-pink-geraniums,Get to Know Red Hot and Pink Geraniums
when-the-forsythia-bloom-prune-roses-for-more-blooms,"When Forsythias Bloom, Prune Roses for More Flowers"
a-real-iron-chefs-6-favorite-grilling-accessories,A Real Iron Chef’s 6 Favorite Grilling Accessories
plant-perennials-in-your-southern-garden,Plant Perennials in Your Southern Garden
spring-flower-and-decor-ideas,Spring Flower and Decor Ideas
how-to-make-a-herbal-marinade-for-grilled-vegetables,How to Make a Herbal Marinade for Grilled Vegetables
drop-and-grow-succulent-and-flower-containers,Drop and Grow Succulent and Flower Containers
when-to-prune-trees-and-shrubs,When to Prune Trees and Shrubs
recipe-st-louis-ribs-with-smoked-onion-bbq-sauce,Recipe: St. Louis Ribs with Smoked Onion BBQ Sauce
6-ways-to-use-citrus-all-year,6 Ways to Use Citrus All Year
how-to-start-seeds-in-peat-pots,How to Start Seeds in Peat Pots
how-to-get-rid-of-moss-in-your-lawn​,How to Get Rid of Moss in Your Lawn
frost-date-calendar,Frost Date Calendar 
fall-flower-ideas,Fall Flower Ideas
how-to-pick-the-right-color-mulch,How to Pick the Right Color Mulch
how-to-grow-vines-and-shrubs-to-fill-in-your-garden,How to Grow Vines and Shrubs to Fill in Your Garden
how-to-grow-and-use-oregano-in-your-garden,How to Grow and Use Oregano in Your Garden
how-to-attract-bees-to-your-garden,How to Attract Bees to Your Garden
when-to-prune-roses,When to Prune Roses
recipe-the-easiest-pulled-pork-you’ll-ever-try,Recipe: The Easiest Pulled Pork You’ll Ever Try
planting-ornamental-grasses-in-containers,Planting Ornamental Grasses in Containers
how-to-grill-foil-wrapped-baby-back-ribs-with-mexican-style-corn,How to Grill Foil-Wrapped Baby Back Ribs with Mexican-Style Corn
recipe-easy-freedom-tart-for-a-patriotic-picnic,Recipe: Easy Freedom Tart for a Patriotic Picnic
how-to-clean-a-birdbath,How to Clean a Birdbath
how-to-insulate-your-garden-with-mulch,How to Insulate Your Garden with Mulch
how-to-use-a-weber-grill,How to Use a Weber Grill
how-to-grow-cyclamen,How to Grow Cyclamen
how-to-prevent-weeds-in-garden-beds,How to Prevent Weeds in Garden Beds
how-to-extend-fall-growing-season,How to Extend the Fall Growing Season
garden-water-feature-ideas,Garden Water Feature Ideas
how-to-start-a-flower-garden,How to Start a Flower Garden
christmas-tree-recycling,Christmas Tree Recycling
10-of-the-most-popular-vegetable-seeds-to-sow,10 of the Most Popular Vegetable Seeds to Sow
garden-technology-and-innovation,Garden Technology and Innovation
how-to-make-homemade-pulled-pork-with-barbecue-sauce,How to Make Homemade Pulled Pork with Barbecue Sauce
preparing-cool-season-grass-for-fall,Preparing Cool-Season Grass for Fall
flavor-grilled-steak-and-vegetables-with-fresh-herb-butter,Flavor Grilled Steak and Vegetables With Fresh Herb Butter
how-to-get-rid-of-summer-bugs,How to Get Rid of Summer Bugs
grow-lavender-in-your-herb-garden,Grow Lavender in Your Herb Garden
knock-out-roses-bring-season-long-blooms-to-your-garden,Knock Out Roses Bring Season-Long Blooms to Your Garden
tips-to-help-your-landscape-survive-a-heat-wave,Tips to Help Your Landscape Survive a Heat Wave
how-to-measure-bar-stools,How to Measure Bar Stools
companion-planting-for-growing-organically,Companion Planting for Growing Organically
how-to-fix-dead-grass,How to Fix Dead Grass
how-to-cook-holiday-dinner-in-a-smoker,How to Cook Holiday Dinner in a Smoker
how-to-be-the-best-new-houseplant-parent,How to Be the Best New Houseplant Parent
mind-these-dos-and-donts-when-starting-seeds,Mind These Do’s and Don’ts When Starting Seeds
drought-tolerant-landscaping,Drought Tolerant Landscaping
how-to-make-pumpkin-pie-puree,How to Make Pumpkin Pie Puree
3-diy-projects-to-try-when-its-too-hot-to-garden,3 DIY Projects to Try When it’s Too Hot to Garden
how-to-test-your-soil-for-spring,How to Test Your Soil for Spring
how-to-style-an-entryway,How to Style an Entryway
how-to-grow-an-indoor-hydroponic-garden,How to Grow an Indoor Hydroponic Garden
caladium-care-and-planting-caladiums,Caladium Care and Planting Caladiums
how-to-grow-3-amazing-plants-in-strawberry-jars,How to Grow 3 Amazing Plants in Strawberry Jars
tips-for-watering-trees-and-shrubs,Tips for Watering Trees and Shrubs
how-to-prune-crepe-myrtles-and-roses,How to Prune Crepe Myrtles and Roses
introducing-miracle-gro-performance-organics,Introducing Miracle-Gro Performance Organics
the-basics-of-home-canning,The Basics of Home Canning
knife-maintenance,Knife Maintenance
fast-growing-vines-for-shade,Fast Growing Vines for Shade
linen-closet-organization,Linen Closet Organization
how-to-care-for-houseplants,How to Care for Houseplants
how-to-fight-powdery-mildew-in-your-garden,How to Fight Powdery Mildew in Your Garden
3-ways-to-find-what-you-need-for-your-project,3 Ways to Find What You Need for Your Project
3-ways-to-cook-a-turkey,3 Ways to Cook a Turkey
how-to-get-rid-of-fire-ants,How to Get Rid of Fire Ants
fall-vegetable-gardening,Fall Vegetable Gardening
video-annuals-vs-perennials,Know the Difference Between Annuals vs. Perennials
how-to-grow-potatoes,How to Grow Potatoes in a Potato Barrel
how-to-grow-an-organic-garden,3 Tips for an Organic Garden
grow-bold-and-beautiful-tropical-plants-this-summer,Grow Bold and Beautiful Tropical Plants This Summer
3-creative-ways-to-reuse-egg-cartons,3 Creative Ways to Reuse Egg Cartons 
create-a-touchless-kitchen-&-stressfree-coffee-station,Create a Touchless Kitchen & Stress-Free Coffee Station
how-to-stake-plants,How To Stake Plants
how-to-prep-your-kitchen-for-guests,How to Prep Your Kitchen for Guests
small-rose-garden-ideas,Small Rose Garden Ideas
caring-for-bromeliads,Caring for Bromeliads
best-ground-cover-for-slopes,Best Ground Cover for Slopes
wind-resistant-plant-ideas,Wind Resistant Plant Ideas
console-table-ideas,Console Table Ideas
prep-your-garden-for-edibles,Prep Your Garden for Edibles
media-center-ideas,Media Center Ideas
commercial-mosquito-control-and-prevention,Commercial Mosquito Control and Prevention
how-to-test-soil-ph,How to Test Soil pH
best-planters-for-your-gardening-needs,Best Planters for Your Gardening Needs
landscape-and-garden-tips-how-to-recover-after-a-flood,Landscape and Garden Tips: How to Recover After a Flood
where-to-plant-a-tree,Where to Plant a Tree
natural-mosquito-repellant-plants,Mosquito Repellent Plants for Your Yard
what-makes-a-great-plant-better-for-your-garden,What Makes a Great Plant Better for Your Garden
confined-spaces-definition-&-permit-requirements,Confined Spaces Definition & Permit Requirements
how-to-make-mulch-with-leaves,How to Make Mulch with Leaves
3-ways-to-use-builder's-paper,3 Ways to Use Builder's Paper 
3-ways-to-repurpose-a-paint-can,3 Ways to Repurpose a Paint Can 
how-to-grow-blueberries,How to Grow Blueberries
recipe-make-paella-with-seafood-sausage-and-chicken,"Recipe: Make Paella with Seafood, Sausage and Chicken"
3-creative-ways-to-display-hypertufa-in-your-outdoor-space,3 Creative Ways to Display Hypertufa in Your Outdoor Space
begin-your-day-the-right-way-with-a-blueberry-breakfast-bowl,Begin Your Day the Right Way With a Blueberry Breakfast Bowl
