slug,title
best-grow-lights-for-seedlings,Best Grow Lights for Seedlings
best-wall-decor-for-your-home,Best Wall Decor for Your Home
how-to-kill-weeds-early-in-the-season,How to Kill Weeds Early in the Season
best-pellets-for-smoking,Grill Pellets Buying Guide
best-work-light-for-you,Best Work Light for You
how-to-clean-windows,How to Clean Windows
how-to-get-rid-of-armyworms,How to Get Rid of Armyworms
best-scroll-saws-for-your-project,Best Scroll Saws for Your Project
rotary-tools,Rotary Tools
how-to-choose-lumber,How to Choose Lumber
best-electrical-testers-and-meters-for-voltage-diagnosis,Best Electrical Testers and Meters for Voltage Diagnosis
structured-wiring-and-networking-panels,Structured Wiring and Networking Panels
parts-of-a-toilet,Parts of a Toilet
interlocking-storage-systems-guide-for-tool-storage,Interlocking Storage Systems Guide for Tool Storage
household-cleaners,Household Cleaners
best-reciprocating-saws-for-your-project,Best Reciprocating Saws for Your Project
choosing-a-residential-surveillance-system,Choosing a Residential Surveillance System
what-is-ppe-and-why-is-it-important,What Is PPE and Why Is It Important
types-of-annuals,Types of Annuals
best-garden-hoses-for-your-yard,Best Garden Hoses for Your Yard
copper-press-fittings-vs-solder,Press Fitting vs. Solder
types-of-wallpaper,Types of Wallpaper
best-dog-crates-and-training-tools-for-your-furry-friend,Best Dog Crates and Training Tools for Your Furry Friend
security-flood-lights-for-your-home,Security Flood Lights for Your Home
how-deionization-of-water-works,How Deionization of Water Works
types-of-pond-cleaners-and-accessories,Types of Pond Cleaners and Accessories
latex-vs.-nitrile-gloves,Latex vs. Nitrile Gloves
types-of-boat-paint-and-marine-paint,Types of Boat Paint and Marine Paint
best-pond-pumps-for-your-garden,Best Pond Pumps for Your Garden
how-to-choose-the-best-concrete-paint,How to Choose the Best Concrete Paint
best-paint-brushes-for-any-project,Best Paint Brushes for Any Project
cordless-battery-buying-guide,Cordless Battery Buying Guide
how-to-remove-paint-from-wood,How to Remove Paint From Wood
how-to-prepare-for-a-hurricane,How to Prepare for a Hurricane
how-to-choose-a-sound-bar,How to Choose a Sound Bar
types-of-trailers,Types of Trailers
how-to-cut-the-cord,How to Cut the Cord
water-resistant-vs-waterproof,Water-resistant vs Water-repellent vs Waterproof
best-home-saunas-for-you,Best Home Saunas for You
best-dimmer-switches-for-your-home,Best Dimmer Switches for Your Home
types-of-welding,Types of Welding
hide-electrical-outlets-&-wires,Easy Ways to Hide Electrical Outlets & Wires
best-insect-repellent-for-your-protection,Best Insect Repellent for Your Protection
how-to-clean-an-air-purifier,How to Clean an Air Purifier
best-toro-products-for-your-yard,Best Toro Products for Your Yard
best-band-saws-for-your-project,Best Band Saws for Your Project
best-safety-equipment-for-painting,Best Safety Equipment for Painting
how-to-use-a-pizza-stone,How to Use a Pizza Stone 
things-you-didn't-know-home-depot-can-repair-for-you,Things You Didn't Know Home Depot Can Repair for You
garden-with-grow-lights,Garden with Grow Lights
the-types-of-drinking-glasses-you-need-in-your-kitchen-,The Types of Drinking Glasses You Need in Your Kitchen 
best-vigoro-products-for-your-yard,Best Vigoro Products for Your Yard
the-best-cast-iron-skillets-for-your-kitchen,The Best Cast Iron Skillets for Your Kitchen
how-do-tankless-water-heaters-work,How Do Tankless Water Heaters Work?
types-of-audio-cables,Types of Audio Cables
best-washing-machine-stands-and-kits-for-your-laundry-room,Best Washing Machine Stands and Kits for Your Laundry Room
types-of-sockets-and-ratchets,"Ratchets and Sockets: Sizes, Types and Uses"
3-ways-to-get-the-look-of-hardwood-for-less,3 Ways to Get the Look of Hardwood for Less
brad-nails-vs-finish-nails,Brad Nails vs. Finish Nails
best-sprinkler-pump-for-your-yard,Best Sprinkler Pump for Your Yard
fiddle-leaf-fig-care,Fiddle-Leaf Fig Care
buying-an-inverter-generator,Buying an Inverter Generator
types-of-tube-lights,Types of Tube Lights
what-is-a-thermocouple,What Is a Thermocouple
the-difference-between-in-stock-and-custom-cabinets,The Difference Between In-Stock and Custom Cabinets
daylight-bulbs-vs-soft-white-bulbs,Daylight Bulbs vs Soft White Bulbs
composite-toe-vs.-steel-toe,Composite Toe vs. Steel Toe Boots
chainsaw-safety-tips,Chainsaw Safety Tips
types-of-paint-finishes,Types of Paint Finishes 
types-of-stovetops,Types of Stovetops
rv-accessories-and-rv-supplies,RV Accessories and RV Supplies
types-of-pepper-plants-to-grow,Types of Pepper Plants to Grow
indoor-plant-growing-with-led-lights,Indoor Plant Growing with LED Lights
best-corded-drills-for-your-project,Best Corded Drills for Your Project
gas-vs-electric-stoves,Gas vs. Electric Stoves
carbon-monoxide-sources,Carbon Monoxide Sources
reverse-osmosis-for-filtered-water,Reverse Osmosis for Filtered Water
types-of-awnings,Types of Awnings
how-to-choose-the-right-tilt-option-for-your-window-treatments,How to Choose the Right Tilt Option for Your Window Treatments
ball-valves-vs-gate-valves,Ball Valves vs Gate Valves
types-of-pressure-treated-wood,Types of Pressure-Treated Wood
how-to-choose-cabinet-makeover-or-new-cabinets,How to Choose Cabinet Makeover or New Cabinets
ladder-safety-tips,Ladder Safety Tips
best-lawn-spreaders-for-your-yard,Best Lawn Spreaders for Your Yard
best-fireplace-accessories-for-your-home,Best Fireplace Accessories for Your Home
4-questions-to-help-you-choose-the-best-dining-room-table,4 Questions to Help You Choose the Best Dining Room Table
how-to-use-a-drill,How to Use a Drill
how-to-choose-a-patio-heater,How to Choose a Patio Heater
vanity-light-height,Vanity Light Height
best-wood-stoves,Best Wood Stoves for Heating Your Home
how-to-iron,How to Iron
washer-and-dryer-dimensions,Washer and Dryer Dimensions 
types-of-curtain-rods,Types of Curtain Rods
how-to-use-an-air-fryer,How to Use an Air Fryer
how-to-choose-the-best-wifi-router-for-your-home,How to Choose the Best Wifi Router for Your Home
best-rice-cooker-for-you,Best Rice Cooker for Your Kitchen
diy-home-security-systems-guide,DIY Home Security Systems
gas-vs-electric-pressure-washers,Gas vs Electric Pressure Washers
the-best-coffee-grinders-to-boost-your-coffees-flavor,The Best Coffee Grinders to Boost Your Coffee's Flavor
how-to-care-for-annuals,How to Care for Annuals
types-of-outdoor-rugs,Types of Outdoor Rugs 
cleaning-benefits-of-microfiber-cloth,Cleaning Benefits of Microfiber Cloth
how-to-get-rid-of-termites,How to Get Rid of Termites
pellet-grill-buying-guide,Pellet Grill Buying Guide
types-of-smoke-detectors,Types of Smoke Detectors
types-of-electrical-boxes,Types of Electrical Boxes
osha-fire-extinguisher-requirements,OSHA Fire Extinguisher Requirements
how-to-choose-an-irrigation-timer,How to Choose an Irrigation Timer
how-to-create-efficient-maintenance-schedules,How to Create Efficient Maintenance Schedules
how-to-choose-a-fireplace-tv-stand,How to Choose a Fireplace TV Stand
cordless-blinds-safety-&-law,Cordless Blinds Safety & Law
types-of-sod-for-your-lawn,Types of Sod for Your Lawn
best-homebrew-kits-for-beginners,Best Homebrew Kits for Beginners
what-to-expect-during-your-kitchen-remodel,What to Expect During Your Kitchen Remodel
tips-for-selecting-the-right-size-outdoor-wall-lights,Tips for Choosing the Right Size Outdoor Wall Lights
hearing-protection-buying-guide,Hearing Protection Buying Guide
osha-guardrail-requirements,OSHA Guardrail & Handrail Requirements
types-of-grout,Types of Grout
steamer-vs-iron,Steamer vs. Iron: Which to Choose
pool-filters-buying-guide,Pool Filters Buying Guide
lawn-fertilization-tips,Lawn Fertilization Tips
what-is-a-woodworking-jig,What Is a Woodworking Jig
how-to-waterproof-wood-and-masonry,How to Waterproof Wood and Masonry
best-blankets-and-throws,Best Blankets and Throws For Your Home
types-of-roofing-and-attic-ventilations,Types of Roofing & Attic Ventilations
how-to-insulate-windows-in-cold-weather,How to Insulate Windows in Cold Weather
questions-to-ask-when-choosing-hvac-service-providers,Questions to Ask When Choosing HVAC Service Providers
types-of-hurricane-shutters,Types of Hurricane Shutters
best-drain-snakes-and-augers,Best Drain Snakes and Augers
top-down-bottom-up-shades,Top-Down Bottom-Up Shades
types-of-shutters,Types of Shutters
best-truck-accessories-for-your-pickup,Best Truck Accessories for Your Pickup
must-have-automotive-tools-for-mechanics,Must Have Automotive Tools for Mechanics
grounding-vs-bonding,What Is Grounding vs. Bonding
how-to-select-a-pool-pump,How to Select a Pool Pump
how-to-get-started-growing-organic-gardens,How to Get Started Growing Organic Gardens
how-to-build-a-home-gym,How to Build a Home Gym
4-ways-home-depot-can-transform-your-backyard,4 Ways Home Depot Can Transform Your Backyard
best-cordless-vacuums-for-you,Best Cordless Vacuums for You
best-robot-vacuums-for-you,Best Robot Vacuums for You
how-do-ductless-air-conditioners-work,How Do Ductless Air Conditioners Work
moving-tips-checklist,Moving Tips Checklist
how-to-choose-the-best-welding-helmet,How to Choose the Best Welding Helmet
best-bath-mats-and-bath-rugs-for-your-bathroom,Best Bath Mats and Bath Rugs For Your Bathroom
best-christmas-wreaths-for-your-home,Best Christmas Wreaths and Garlands for Your Home
pole-saw-buying-guide,Pole Saw Buying Guide
broadloom-vs-carpet-tiles,Broadloom vs. Carpet Tiles
everything-you-need-for-a-business-first-aid-kit,How to Stock a Business First Aid Kit
specialty-and-arched-window-treatments,Specialty and Arched Window Treatments
commercial-generator-buying-guide,Commercial Generator Buying Guide
how-to-choose-vent-covers,How to Choose Vent Covers
best-bathroom-exhaust-fans-for-your-home,Best Bathroom Exhaust Fans for Your Home 
how-to-use-mulch-in-the-garden,How to Use Mulch in the Garden
best-perennials-for-your-garden,Best Perennials For Your Garden
ladder-accessories-buying-guide,Ladder Accessories Buying Guide
how-to-choose-a-water-heater-service-provider,How to Choose a Water Heater Service Provider
how-to-care-for-roses,How to Care for Roses
choose-the-right-commercial-water-heater,Choose the Right Commercial Water Heater
home-fire-safety-equipment,Home Fire Safety Equipment
office-cleaning-equipment-list,Office Cleaning Equipment List
best-paint-stripper-for-your-project,Best Paint Stripper For Your Project
the-best-steak-knives-for-your-kitchen,The Best Steak Knives for Your Kitchen
best-electrical-tools-for-your-project,Best Electrical Tools for Your Project
welding-tips,Welding Tips: How to Prep for Any Welding Project
best-smart-door-locks-for-home-security,Best Smart Door Locks for Home Security
grades-of-bolts,Grades of Bolts
shelter-in-place-drill-checklist,Shelter in Place Drill Checklist
how-to-remove-stains-from-concrete,How to Remove Stains From Concrete
best-thermostats-for-your-home,Best Thermostats for Your Home
how-to-choose-hvac-units-for-apartments,How to Choose HVAC Units for Apartments
best-paint-for-your-next-cabinet-project,Best Paint for Your Next Cabinet Project
what-is-an-evaporative-cooler,What is an Evaporative Cooler​​
when-to-remove-concrete-forms,When to Remove Concrete Forms
best-sanders-for-your-project,Best Sanders for Your Project
best-plumbing-tools,Plumbing Tools List for a Better Toolbox
best-salt-and-pepper-grinders-for-your-kitchen-,Best Salt and Pepper Grinders for Your Kitchen 
apartment-fire-safety,Apartment Fire Safety
choosing-the-right-size-generator,Choosing the Right Size Generator
"preventing-workplace-slips,-trips-&-falls-","Preventing Workplace Slips, Trips & Falls "
types-of-washers-and-nuts,Types of Washers
types-of-paints-and-stains-for-concrete-floors,Types of Paints and Stains for Concrete Floors
types-of-nails,Types of Nails
how-to-make-a-bed-comfy-and-restful,How to Make a Bed Comfy and Restful
best-safety-glasses-for-your-job,Best Safety Glasses for Your Job Site
hydroponic-gardening-guide,Hydroponic Gardening Guide
best-fans-for-cooling-a-room,Best Fans for Cooling a Room
choosing-the-best-hvac-brand-for-your-home,Choosing the Best HVAC Brand for Your Home
pool-furniture-buying-guide,Pool Furniture Buying Guide
what-is-leed,What Is LEED?
jet-dyers-vs-paper-towels,Hand Dryers vs. Paper Towels
types-of-fireplaces-and-mantels,Types of Fireplaces and Mantels
how-to-fold-a-fitted-sheet,How to Fold a Fitted Sheet
what-is-firestopping,What Is Firestopping
how-to-dispose-of-lightbulbs,How to Dispose of Lightbulbs
how-to-use-a-dehydrator,How to Use a Dehydrator
best-boxes-for-moving,Best Boxes for Moving 
kitchen-update-options-for-every-home,Kitchen Update Options for Every Home
how-to-wash-a-comforter,How to Wash a Comforter
types-of-laminate-flooring,Types of Laminate Flooring
how-to-buy-electrical-panels,How to Buy Electrical Panels
wear-&-tear-vs.-damage,Wear & Tear vs. Damage
best-electric-knife-sharpeners-and-why-they're-worth-it,Best Electric Knife Sharpeners and Why They're Worth It
types-of-flooring,Types of Flooring
how-to-choose-the-best-ptac-unit-for-your-property,How to Choose the Best PTAC Unit for Your Property
best-vinyl-tubing-for-your-project,Best Vinyl Tubing for Your Project
best-applicators-stain-applicator,How to Choose The Right Applicators for Exterior Stain Projects
how-to-build-basic-concrete-forms,How to Build Basic Concrete Forms
best-motorized-blinds-for-your-home,Best Motorized Blinds for Your Home
best-blinds-for-child-safety,Best Blinds for Child Safety
best-router-bits-for-your-project,Best Router Bits for Your Project
how-to-draw-a-floor-plan,How to Draw a Floor Plan
how-to-sharpen-knives,How to Sharpen Knives
the-best-ice-cream-makers-for-homemade-frozen-treats,The Best Ice Cream Makers for Homemade Frozen Treats
best-exterior-stain-applicator,How to choose the Best Exterior Stain Applicator
how-to-get-rid-of-spittlebugs,How to Get Rid of Spittlebugs
landlord-responsibilities-101,Landlord Responsibilities 101
how-to-paint-interior-doors,How to Paint Interior Doors
create-your-own-patio-collection,Create Your Own Patio Collection 
how-to-get-rid-of-yellow-jackets,How to Get Rid of Yellow Jackets
energy-efficient-window-treatments,Energy Efficient Window Treatments
inspiring-kitchen-island-ideas,Inspiring Kitchen Island Ideas
led-vs-fluorescent,LED vs Fluorescent
types-of-moulding,Types of Moulding
best-shower-heads-for-your-bathroom,Best Shower Heads for Your Bathroom
mailbox-regulations,Mailbox Regulations and Rules
best-hedge-trimmers-for-your-shrubs,Best Hedge Trimmers For Your Shrubs
best-jigsaws-for-your-project,Best Jigsaws for Your Project
how-to-use-a-gas-grill,How To Use a Gas Grill
types-of-plywood,Types of Plywood
best-storm-doors-and-screen-doors-for-your-home,Best Storm Doors and Screen Doors for Your Home
how-to-make-your-rental-property-a-smart-apartment,Make a Rental Unit a Smart Apartment
the-best-kitchen-shears-for-all-of-your-cooking-needs,The Best Kitchen Shears for All of Your Cooking Needs
impact-drivers-vs-drills,Impact Drivers vs. Drills
best-tool-belts-bags-pouches,"Best Tool Belts, Bags and Pouches for Your Home Projects"
charcoal-vs-gas-grills,Charcoal vs. Gas Grills 
new-home-checklist,New Home Checklist
bathroom-upgrades-for-your-rental-property,Bathroom Upgrades for Your Rental Property
best-toaster-ovens-for-your-kitchen-countertop,Best Toaster Ovens for Your Kitchen
5-ways-home-depot-can-make-your-home-energy-efficient,5 Ways Home Depot Can Make Your Home Energy Efficient
best-furniture-for-your-home,Best Furniture for Your Home
the-best-mixing-bowls-you-can-buy-for-your-kitchen,The Best Mixing Bowls You Can Buy for Your Kitchen
how-to-use-a-nail-gun,How to Use a Nail Gun
best-sprinklers-for-your-lawn-and-garden,Best Sprinklers for Your Lawn and Garden
how-to-measure-sleeve-length,How to Measure Sleeve Length
types-of-fire-extinguishers,Types of Fire Extinguishers
best-kitchen-cabinet-refacing-for-your-home,Best Kitchen Cabinet Refacing for Your Home
glacier-bay-customer-service,Glacier Bay Customer Service
types-of-drywall,Types of Drywall
how-to-dispose-of-batteries,How to Dispose of Batteries
types-of-carpet,Types of Carpet
parking-lot-lighting-standards,Parking Lot Lighting Standards
how-to-get-rid-of-carpenter-bees,How to Get Rid of Carpenter Bees
best-bathtub-safety-equipment-for-your-home,Best Bathtub Safety Equipment for Your Home
hvac-basics,HVAC Basics
best-sump-pumps-for-your-basement-or-crawlspace,Best Sump Pumps for Your Basement or Crawlspace 
easy-ways-to-improve-rental-property-security,Easy Ways to Improve Rental Property Security
best-food-processors-for-your-kitchen,Best Food Processors for Your Kitchen
types-of-shower-valves,Types of Shower Valves
national-electrical-code-changes-in-2020,National Electrical Code Changes in 2020
types-of-carpet-cleaners,Types of Carpet Cleaners
job-site-safety-for-electricians,Job-Site Safety for Electricians
types-of-file-tools,Types of File Tools
how-to-get-rid-of-crickets,How to Get Rid of Crickets
best-electric-kettles-for-boiling-water,Best Electric Kettles for Boiling Water
best-dishwashers-for-your-kitchen,Best Dishwashers for Your Kitchen
best-interior-paints,Best Interior Paints for Every Room
best-water-dispensers-for-your-kitchen,Best Water Dispensers for Your Kitchen
types-of-solar-panels,Types of Solar Panels
front-load-washer-vs-top-load-washer,Front Load Washer vs. Top Load Washer
road-trip-checklist,Road Trip Checklist
lumens-per-square-foot,Lumens Per Square Foot: Recommended Amount Needed for a Room
the-best-toaster-for-your-kitchen-countertop,Best Toasters For Your Kitchen Countertop
trending-color-palettes-for-businesses,Trending Color Palettes for Businesses
how-to-remove-scratches-from-glass,How to Remove Scratches From Glass
what-are-the-standard-garage-door-sizes,What Are the Standard Garage Door Sizes
duvet-vs-comforters,Duvets vs. Comforters
food-safe-finishes,Food-Safe Finishes
how-water-softeners-work,How Water Softeners Work
parts-of-a-sink,Parts of a Sink
must-know-emergency-lighting-requirements,Must-Know Emergency Lighting Requirements
the-best-frying-pans-for-the-home-cook,The Best Frying Pans For The Home Cook
best-carbon-monoxide-detectors,Best Carbon Monoxide Detectors
how-portable-air-conditioners-work,How Portable Air Conditioners Work
how-to-choose-the-right-size-dehumidifier,How to Choose the Right Size Dehumidifier
types-of-car-jacks,Types of Car Jacks
best-cabinet-hardware-for-your-home,Best Cabinet Hardware for Your Home
best-wall-ovens-for-your-kitchen,Best Wall Ovens for Your Kitchen
best-medicine-cabinets-for-your-bathroom,Best Medicine Cabinets for Your Bathroom
guide-to-osha-approved-shoes-,Guide to OSHA-Approved Shoes 
best-window-film-for-your-home,Best Window Film for Your Home
how-to-choose-a-paint-color,How To Choose a Paint Color
best-bathtub-and-shower-faucets,Best Bathtub and Shower Faucets
best-tankless-water-heaters,Best Tankless Water Heaters for Your Home
how-to-prepare-for-a-blizzard,How to Prepare for a Blizzard
how-to-choose-the-best-antenna-for-your-tv,How to Choose the Best Antenna for Your TV 
best-juicers,Best Juicers for Fast and Flavorful Juicing
best-deep-fryers-for-your-home,Best Deep Fryers for Your Home
gfci-requirements-&-legislation,GFCI Requirements & Legislation
Best-Pressure-Washers-For-Your-Project,Best Pressure Washers for Your Project
ensure-safety-with-nfpa-fire-extinguisher-requirements,NFPA 10 Fire Extinguisher Requirements
how-many-lumens-needed-for-outdoor-lighting,How Many Lumens are Needed for Outdoor Lighting
types-of-pipe-fittings,Types of Pipe Fittings
how-to-read-a-tape-measure,How to Read a Tape Measure
types-of-concrete-paint-applicators,Types of Concrete Paint Applicators
how-to-texture-walls,How to Texture Walls
types-of-garden-hoes,Types of Garden Hoes
how-to-remove-wallpaper,How to Remove Wallpaper
design-a-profit-boosting-commercial-patio,Design a Profit-Boosting Commercial Patio
best-doorbells-for-your-home,Best Doorbells for Your Home
insulation-r-values,All About Insulation R-Values
how-to-get-rid-of-wasps,How to Get Rid of Wasps
how-to-repair-cracks-in-a-concrete-driveway,How to Repair Cracks in a Concrete Driveway
best-range-hoods-for-your-kitchen,Best Range Hoods for Your Kitchen
how-to-get-rid-of-snakes,How to Get Rid of Snakes
types-of-circuit-breakers,Types of Circuit Breakers
types-of-truck-bed-covers,Types of Truck Bed Covers
new-lighting-technology-enhances-smart-controls,New Lighting Tech Enhances Smart Controls
best-handheld-vacuums,Best Handheld Vacuums to Keep Your Home Tidy
best-bathroom-vanities-for-your-home,Best Bathroom Vanities for Your Home
best-ceiling-paint-for-your-home,Best Ceiling Paint for Your Home
hard-hat-classes-regulations-safety,"Hard Hat Classes, Regulations & Safety Tips"
how-to-use-a-sander,How to Use a Sander
best-flooring-for-a-rental-property,Best Flooring for a Rental Property 
window-treatments-with-light-control,Window Treatments with Light Control
outdoor-lighting-ideas,Best Outdoor Lighting for Your Yard 
best-sheds-for-outdoor-storage,Best Sheds for Outdoor Storage
egress-windows-buying-guide,Egress Windows Buying Guide
types-of-pavers,Types of Pavers
benefits-of-tankless-water-heaters,Benefits of Tankless Water Heaters
how-to-insulate-windows-in-cold-weather,How to Insulate Windows in Cold Weather
the-best-shower-curtain,The Best Shower Curtain for Your Bathroom
types-of-fence-materials-and-hardware,Types of Fence Materials and Hardware
best-flooring-for-a-rental-property,Best Flooring for a Rental Property
firewood-buying-guide,Firewood Buying Guide
the-best-oven-mitts-and-pot-holders-to-protect-your-hands,The Best Oven Mitts and Pot Holders to Protect Your Hands
improve-office-lighting-for-better-productivity,Improve Office Lighting to Boost Productivity
how-to-use-a-clothes-steamer,How to Use a Clothes Steamer 
best-solar-panels-for-your-home,Best Solar Panels for Your Home
choosing-a-bike-rack-for-a-car,Choosing a Bike Rack for a Car
how-to-choose-the-best-bed-sheets,How to Choose the Best Bed Sheets for Your Bedroom
best-dehumidifiers-for-your-home,Best Dehumidifiers for Your Home
best-intercom-systems-for-your-home,Best Intercom Systems for Your Home
the-best-wine-glasses-to-complement-any-wine,The Best Wine Glasses to Complement Any Wine
wine-coolers-buying-guide,Wine Coolers Buying Guide 
best-circular-saws,Best Circular Saws for You
how-to-get-rid-of-bed-bugs,How to Get Rid of Bed Bugs
best-carpet-for-pets,Best Carpet for Pets
best-bread-knife-for-your-slicing-needs,Best Bread Knife for Your Slicing Needs
best-weed-killer-for-your-yard,Best Weed Killer for Your Yard
types-of-vinyl-flooring,Types of Vinyl Flooring
types-of-wood-finishes,Types of Wood Finishes
tailgate-ideas,Tailgate Ideas
recessed-lighting-buying-guide,Recessed Lighting Buying Guide
best-caulks-and-sealants-for-your-home-improvement-projects,Best Caulks and Sealants for Your Home Improvement Projects 
butcher-block-countertops-buying-guide,Butcher Block Countertops Buying Guide 
choosing-a-bike-rack-for-a-car,Choosing a Bike Rack for a Car
best-meat-thermometers,Best Meat Thermometers for More Precise Cooking
types-of-water-heaters,Types of Water Heaters
the-best-dutch-oven-for-you,The Best Dutch Oven for Your Cooking Tasks
best-kitchen-faucets-for-your-home,Best Kitchen Faucets for Your Home
how-to-get-rid-of-fleas,How to Get Rid of Fleas
how-to-use-a-drywall-anchor,How to Use a Drywall Anchor
how-to-french-press-coffee,How to French Press Coffee
best-storage-containers-for-your-home,Best Storage Containers for Your Home
how-to-secure-your-windows,How to Secure Your Windows
commercial-irrigation-system-installation-&-maintenance-tips,Commercial Irrigation System Tips
best-espresso-machines-for-your-kitchen,The Best Espresso Machine for Your Kitchen
accidents-vs.-incidents-in-workplace-safety,Accidents vs. Incidents in Workplace Safety
induction-cooktop-buying-guide,Induction Cooktop Buying Guide
the-best-measuring-cups-and-spoons-for-your-cooking-tasks,The Best Measuring Cups and Spoons for Your Cooking Tasks
how-to-finish-tile-edges,3 Easy Tile Edging Options Clients Love 
best-radial-arm-saw-for-your-project,Best Radial Arm Saw for Your Project
best-coffee-mugs-for-your-hot-beverages,Best Coffee Mugs for Your Hot Beverages
6-things-you-didn't-know-home-depot-can-install-for-you,6 Things You Didn't Know Home Depot Can Install for You
best-high-efficiency-washing-machines-for-your-home,Best High-Efficiency Washing Machines for Your Home
how-to-measure-a-lamp-shade,How to Measure a Lamp Shade
types-of-shower-bases-and-walls,Types of Shower Bases and Walls
how-to-perform-a-respirator-fit-test,How to Perform a Respirator Fit Test
designing-a-playground,5 Steps for Designing a Playground
types-of-gutters,Types of Gutters
what-to-expect-during-your-hard-surface-flooring-installation,What to Expect During Your Hard Surface Flooring Installation
best-coffee-makers-for-your-home,Best Coffee Makers for Your Home
best-toilet-plungers-and-sink-plungers,Best Toilet Plungers and Sink Plungers
charcoal-grill-buying-guide,Charcoal Grill Buying Guide
how-to-choose-the-best-iron,How to Choose the Best Iron
types-of-blinds,Types of Blinds
best-air-fryers,Best Air Fryers
types-of-bike-racks-for-suvs,Types of Bike Racks for SUVs
types-of-cabinet-hinges,Types of Cabinet Hinges
how-to-pack-for-a-move,How to Pack for a Move
how-to-choose-a-cat-door,How to Choose a Cat Door
types-of-water-softeners,Types of Water Softeners
types-of-wire-connectors,Types of Wire Connectors
